{
  "schema_version": 1,
  "generated_at": "2026-07-12T15:23:33.400Z",
  "date": "2026-07-11",
  "expires_at": "2026-07-13T15:23:33.400Z",
  "source": {
    "provider": "google_trends",
    "dataset": "bigquery-public-data.google_trends",
    "region": "US",
    "tables": [
      "top_terms",
      "top_rising_terms"
    ],
    "attribution": "Data source: Google Trends"
  },
  "items": [
    {
      "rank": 1,
      "slug": "spark",
      "word": "spark",
      "score": 97,
      "reason": "rising_search",
      "matched_terms": [
        "fever vs sparks"
      ]
    },
    {
      "rank": 2,
      "slug": "belgium",
      "word": "Belgium",
      "score": 90,
      "reason": "rising_search",
      "matched_terms": [
        "belgium vs spain"
      ]
    },
    {
      "rank": 3,
      "slug": "game",
      "word": "game",
      "score": 89,
      "reason": "top_search",
      "matched_terms": [
        "what time is the world cup game today"
      ]
    },
    {
      "rank": 4,
      "slug": "fever",
      "word": "fever",
      "score": 89,
      "reason": "rising_search",
      "matched_terms": [
        "fever vs sparks"
      ]
    },
    {
      "rank": 5,
      "slug": "recall",
      "word": "recall",
      "score": 89,
      "reason": "rising_search",
      "matched_terms": [
        "walmart cuisinart metal bristle recall"
      ]
    },
    {
      "rank": 6,
      "slug": "dream",
      "word": "dream",
      "score": 84,
      "reason": "top_search",
      "matched_terms": [
        "fire vs dream"
      ]
    },
    {
      "rank": 7,
      "slug": "outbreak",
      "word": "outbreak",
      "score": 84,
      "reason": "rising_search",
      "matched_terms": [
        "cyclospora parasite outbreak"
      ]
    },
    {
      "rank": 8,
      "slug": "time",
      "word": "time",
      "score": 83,
      "reason": "top_search",
      "matched_terms": [
        "what time is the world cup game today"
      ]
    },
    {
      "rank": 9,
      "slug": "world",
      "word": "world",
      "score": 83,
      "reason": "mixed_signal",
      "matched_terms": [
        "morocco world cup",
        "what time is the world cup game today",
        "france world cup",
        "spain world cup"
      ]
    }
  ],
  "fallback_used": false
}
