{
  "schema_version": 1,
  "generated_at": "2026-05-17T10:54:08.077Z",
  "date": "2026-05-16",
  "expires_at": "2026-05-18T10:54:08.077Z",
  "source": {
    "provider": "google_trends",
    "dataset": "bigquery-public-data.google_trends",
    "region": "US",
    "tables": [
      "top_terms",
      "top_rising_terms"
    ],
    "attribution": "Data source: Google Trends"
  },
  "items": [
    {
      "rank": 1,
      "slug": "trap",
      "word": "trap",
      "score": 91,
      "reason": "rising_search",
      "matched_terms": [
        "thucydides trap"
      ]
    },
    {
      "rank": 2,
      "slug": "time",
      "word": "time",
      "score": 90,
      "reason": "top_search",
      "matched_terms": [
        "preakness post time",
        "what time is the ronda rousey fight"
      ]
    },
    {
      "rank": 3,
      "slug": "chain",
      "word": "chain",
      "score": 87,
      "reason": "rising_search",
      "matched_terms": [
        "restaurant chain"
      ]
    },
    {
      "rank": 4,
      "slug": "want",
      "word": "want",
      "score": 86,
      "reason": "rising_search",
      "matched_terms": [
        "monica witt fbi wanted"
      ]
    },
    {
      "rank": 5,
      "slug": "qualify",
      "word": "qualify",
      "score": 83,
      "reason": "top_search",
      "matched_terms": [
        "indy 500 qualifying"
      ]
    },
    {
      "rank": 6,
      "slug": "restaurant",
      "word": "restaurant",
      "score": 81,
      "reason": "rising_search",
      "matched_terms": [
        "restaurant chain"
      ]
    },
    {
      "rank": 7,
      "slug": "golf",
      "word": "golf",
      "score": 80,
      "reason": "top_search",
      "matched_terms": [
        "rai golfer"
      ]
    },
    {
      "rank": 8,
      "slug": "champion",
      "word": "champion",
      "score": 79,
      "reason": "rising_search",
      "matched_terms": [
        "pga championship 2026 leaderboard",
        "pga championship 2026",
        "pga championship"
      ]
    },
    {
      "rank": 9,
      "slug": "hour",
      "word": "hour",
      "score": 79,
      "reason": "top_search",
      "matched_terms": [
        "24 hours of nurburgring"
      ]
    }
  ],
  "fallback_used": false
}
