{
  "schema_version": 1,
  "generated_at": "2026-06-29T16:19:03.454Z",
  "date": "2026-06-28",
  "expires_at": "2026-06-30T16:19:03.454Z",
  "source": {
    "provider": "google_trends",
    "dataset": "bigquery-public-data.google_trends",
    "region": "US",
    "tables": [
      "top_terms",
      "top_rising_terms"
    ],
    "attribution": "Data source: Google Trends"
  },
  "items": [
    {
      "rank": 1,
      "slug": "iraq",
      "word": "Iraq",
      "score": 88,
      "reason": "rising_search",
      "matched_terms": [
        "senegal vs iraq"
      ]
    },
    {
      "rank": 2,
      "slug": "attack",
      "word": "attack",
      "score": 88,
      "reason": "top_search",
      "matched_terms": [
        "bahrain iran attack"
      ]
    },
    {
      "rank": 3,
      "slug": "persian",
      "word": "Persian",
      "score": 86,
      "reason": "mixed_signal",
      "matched_terms": [
        "egypt vs iran",
        "bahrain iran attack"
      ]
    },
    {
      "rank": 4,
      "slug": "plan",
      "word": "plan",
      "score": 85,
      "reason": "top_search",
      "matched_terms": [
        "buc-ees expansion plans u.s."
      ]
    },
    {
      "rank": 5,
      "slug": "bracket",
      "word": "bracket",
      "score": 84,
      "reason": "top_search",
      "matched_terms": [
        "fifa world cup 2026 bracket"
      ]
    },
    {
      "rank": 6,
      "slug": "world",
      "word": "world",
      "score": 84,
      "reason": "mixed_signal",
      "matched_terms": [
        "fifa world cup 2026 bracket",
        "belgium world cup"
      ]
    },
    {
      "rank": 7,
      "slug": "belgium",
      "word": "Belgium",
      "score": 84,
      "reason": "rising_search",
      "matched_terms": [
        "belgium world cup",
        "new zealand vs belgium"
      ]
    },
    {
      "rank": 8,
      "slug": "tiger",
      "word": "tiger",
      "score": 83,
      "reason": "top_search",
      "matched_terms": [
        "astros vs tigers"
      ]
    },
    {
      "rank": 9,
      "slug": "wing",
      "word": "wing",
      "score": 79,
      "reason": "top_search",
      "matched_terms": [
        "lynx vs wings"
      ]
    }
  ],
  "fallback_used": false
}
