{
  "schema_version": 1,
  "generated_at": "2026-08-10T15:22:56.005Z",
  "date": "2026-08-09",
  "expires_at": "2026-08-11T15:22:56.005Z",
  "source": {
    "provider": "google_trends",
    "dataset": "bigquery-public-data.google_trends",
    "region": "US",
    "tables": [
      "top_terms",
      "top_rising_terms"
    ],
    "attribution": "Data source: Google Trends"
  },
  "items": [
    {
      "rank": 1,
      "slug": "outbreak",
      "word": "outbreak",
      "score": 92,
      "reason": "rising_search",
      "matched_terms": [
        "louisiana vibrio vulnificus outbreak"
      ]
    },
    {
      "rank": 2,
      "slug": "brave",
      "word": "brave",
      "score": 92,
      "reason": "rising_search",
      "matched_terms": [
        "braves",
        "braves vs yankees"
      ]
    },
    {
      "rank": 3,
      "slug": "earn",
      "word": "earn",
      "score": 91,
      "reason": "rising_search",
      "matched_terms": [
        "earned income tax credit",
        "refund approved irs will send tax refunds of up to $4427 to taxpayers who claimed the earned income tax credit"
      ]
    },
    {
      "rank": 4,
      "slug": "send",
      "word": "send",
      "score": 88,
      "reason": "rising_search",
      "matched_terms": [
        "refund approved irs will send tax refunds of up to $4427 to taxpayers who claimed the earned income tax credit"
      ]
    },
    {
      "rank": 5,
      "slug": "pool",
      "word": "pool",
      "score": 88,
      "reason": "top_search",
      "matched_terms": [
        "reflecting pool"
      ]
    },
    {
      "rank": 6,
      "slug": "reflect",
      "word": "reflect",
      "score": 88,
      "reason": "top_search",
      "matched_terms": [
        "reflecting pool"
      ]
    },
    {
      "rank": 7,
      "slug": "wing",
      "word": "wing",
      "score": 88,
      "reason": "top_search",
      "matched_terms": [
        "wings vs lynx"
      ]
    },
    {
      "rank": 8,
      "slug": "fever",
      "word": "fever",
      "score": 85,
      "reason": "rising_search",
      "matched_terms": [
        "fever vs sky"
      ]
    },
    {
      "rank": 9,
      "slug": "last",
      "word": "last",
      "score": 85,
      "reason": "rising_search",
      "matched_terms": [
        "the last house"
      ]
    }
  ],
  "fallback_used": false
}
