{
  "schema_version": 1,
  "generated_at": "2026-09-16T15:10:19.856Z",
  "date": "2026-09-15",
  "expires_at": "2026-09-17T15:10:19.856Z",
  "source": {
    "provider": "google_trends",
    "dataset": "bigquery-public-data.google_trends",
    "region": "US",
    "tables": [
      "top_terms",
      "top_rising_terms"
    ],
    "attribution": "Data source: Google Trends"
  },
  "items": [
    {
      "rank": 1,
      "slug": "giant",
      "word": "giant",
      "score": 99,
      "reason": "rising_search",
      "matched_terms": [
        "giants vs cowboys"
      ]
    },
    {
      "rank": 2,
      "slug": "spur",
      "word": "spur",
      "score": 92,
      "reason": "top_search",
      "matched_terms": [
        "liverpool vs spurs"
      ]
    },
    {
      "rank": 3,
      "slug": "cowboy",
      "word": "cowboy",
      "score": 91,
      "reason": "rising_search",
      "matched_terms": [
        "giants vs cowboys"
      ]
    },
    {
      "rank": 4,
      "slug": "bear",
      "word": "bear",
      "score": 90,
      "reason": "rising_search",
      "matched_terms": [
        "bears vs panthers"
      ]
    },
    {
      "rank": 5,
      "slug": "lion",
      "word": "lion",
      "score": 88,
      "reason": "rising_search",
      "matched_terms": [
        "saints vs lions"
      ]
    },
    {
      "rank": 6,
      "slug": "saint",
      "word": "saint",
      "score": 88,
      "reason": "rising_search",
      "matched_terms": [
        "saints vs lions"
      ]
    },
    {
      "rank": 7,
      "slug": "eagle",
      "word": "eagle",
      "score": 87,
      "reason": "rising_search",
      "matched_terms": [
        "commanders vs eagles"
      ]
    },
    {
      "rank": 8,
      "slug": "dolphin",
      "word": "dolphin",
      "score": 85,
      "reason": "rising_search",
      "matched_terms": [
        "dolphins vs raiders"
      ]
    },
    {
      "rank": 9,
      "slug": "panther",
      "word": "panther",
      "score": 84,
      "reason": "rising_search",
      "matched_terms": [
        "bears vs panthers"
      ]
    }
  ],
  "fallback_used": false
}
