{
  "schema_version": 1,
  "generated_at": "2026-08-02T15:25:00.855Z",
  "date": "2026-08-01",
  "expires_at": "2026-08-03T15:25:00.855Z",
  "source": {
    "provider": "google_trends",
    "dataset": "bigquery-public-data.google_trends",
    "region": "US",
    "tables": [
      "top_terms",
      "top_rising_terms"
    ],
    "attribution": "Data source: Google Trends"
  },
  "items": [
    {
      "rank": 1,
      "slug": "recall",
      "word": "recall",
      "score": 99,
      "reason": "top_search",
      "matched_terms": [
        "woodure toddler stool recall"
      ]
    },
    {
      "rank": 2,
      "slug": "toddler",
      "word": "toddler",
      "score": 93,
      "reason": "top_search",
      "matched_terms": [
        "woodure toddler stool recall"
      ]
    },
    {
      "rank": 3,
      "slug": "start",
      "word": "start",
      "score": 92,
      "reason": "top_search",
      "matched_terms": [
        "summerslam start time"
      ]
    },
    {
      "rank": 4,
      "slug": "raid",
      "word": "raid",
      "score": 91,
      "reason": "top_search",
      "matched_terms": [
        "linda blair home raided"
      ]
    },
    {
      "rank": 5,
      "slug": "forecast",
      "word": "forecast",
      "score": 90,
      "reason": "top_search",
      "matched_terms": [
        "jensen huang construction careers forecast"
      ]
    },
    {
      "rank": 6,
      "slug": "time",
      "word": "time",
      "score": 86,
      "reason": "top_search",
      "matched_terms": [
        "summerslam start time"
      ]
    },
    {
      "rank": 7,
      "slug": "stop",
      "word": "stop",
      "score": 85,
      "reason": "rising_search",
      "matched_terms": [
        "megan moroney denver show stopped"
      ]
    },
    {
      "rank": 8,
      "slug": "career",
      "word": "career",
      "score": 84,
      "reason": "top_search",
      "matched_terms": [
        "jensen huang construction careers forecast"
      ]
    },
    {
      "rank": 9,
      "slug": "liberty",
      "word": "liberty",
      "score": 83,
      "reason": "top_search",
      "matched_terms": [
        "liberty vs mercury"
      ]
    }
  ],
  "fallback_used": false
}
