{
  "schema_version": 1,
  "generated_at": "2026-06-06T15:30:08.813Z",
  "date": "2026-06-05",
  "expires_at": "2026-06-07T15:30:08.813Z",
  "source": {
    "provider": "google_trends",
    "dataset": "bigquery-public-data.google_trends",
    "region": "US",
    "tables": [
      "top_terms",
      "top_rising_terms"
    ],
    "attribution": "Data source: Google Trends"
  },
  "items": [
    {
      "rank": 1,
      "slug": "giant",
      "word": "giant",
      "score": 97,
      "reason": "top_search",
      "matched_terms": [
        "giants vs cubs"
      ]
    },
    {
      "rank": 2,
      "slug": "bear",
      "word": "bear",
      "score": 86,
      "reason": "top_search",
      "matched_terms": [
        "chicago bears"
      ]
    },
    {
      "rank": 3,
      "slug": "result",
      "word": "result",
      "score": 85,
      "reason": "rising_search",
      "matched_terms": [
        "california election results"
      ]
    },
    {
      "rank": 4,
      "slug": "evil",
      "word": "evil",
      "score": 85,
      "reason": "top_search",
      "matched_terms": [
        "resident evil veronica"
      ]
    },
    {
      "rank": 5,
      "slug": "upgrade",
      "word": "upgrade",
      "score": 84,
      "reason": "top_search",
      "matched_terms": [
        "mcdonald's drive-thru ai upgrade"
      ]
    },
    {
      "rank": 6,
      "slug": "airline",
      "word": "airline",
      "score": 79,
      "reason": "top_search",
      "matched_terms": [
        "southwest airlines new routes"
      ]
    },
    {
      "rank": 7,
      "slug": "route",
      "word": "route",
      "score": 79,
      "reason": "top_search",
      "matched_terms": [
        "southwest airlines new routes"
      ]
    },
    {
      "rank": 8,
      "slug": "embassy",
      "word": "embassy",
      "score": 78,
      "reason": "top_search",
      "matched_terms": [
        "u.s. embassy mexico travel warning"
      ]
    },
    {
      "rank": 9,
      "slug": "market",
      "word": "market",
      "score": 77,
      "reason": "top_search",
      "matched_terms": [
        "stock market today"
      ]
    }
  ],
  "fallback_used": false
}
