{
  "schema_version": 1,
  "generated_at": "2026-10-25T18:07:54.697Z",
  "date": "2026-10-24",
  "expires_at": "2026-10-26T18:07:54.697Z",
  "source": {
    "provider": "google_trends",
    "dataset": "bigquery-public-data.google_trends",
    "region": "US",
    "tables": [
      "top_terms",
      "top_rising_terms"
    ],
    "attribution": "Data source: Google Trends"
  },
  "items": [
    {
      "rank": 1,
      "slug": "bear",
      "word": "bear",
      "score": 96,
      "reason": "rising_search",
      "matched_terms": [
        "bears vs patriots",
        "chicago bears",
        "bears game",
        "bears"
      ]
    },
    {
      "rank": 2,
      "slug": "thunder",
      "word": "thunder",
      "score": 88,
      "reason": "rising_search",
      "matched_terms": [
        "nuggets vs thunder"
      ]
    },
    {
      "rank": 3,
      "slug": "game",
      "word": "game",
      "score": 87,
      "reason": "rising_search",
      "matched_terms": [
        "bears game"
      ]
    },
    {
      "rank": 4,
      "slug": "oklahoma",
      "word": "Oklahoma",
      "score": 86,
      "reason": "top_search",
      "matched_terms": [
        "oklahoma vs ms state"
      ]
    },
    {
      "rank": 5,
      "slug": "skin",
      "word": "skin",
      "score": 86,
      "reason": "top_search",
      "matched_terms": [
        "under the skin netflix departure"
      ]
    },
    {
      "rank": 6,
      "slug": "under",
      "word": "under",
      "score": 86,
      "reason": "top_search",
      "matched_terms": [
        "under the skin netflix departure"
      ]
    },
    {
      "rank": 7,
      "slug": "shy",
      "word": "shy",
      "score": 84,
      "reason": "rising_search",
      "matched_terms": [
        "shyness"
      ]
    },
    {
      "rank": 8,
      "slug": "football",
      "word": "football",
      "score": 82,
      "reason": "rising_search",
      "matched_terms": [
        "thursday night football"
      ]
    },
    {
      "rank": 9,
      "slug": "caribbean",
      "word": "Caribbean",
      "score": 80,
      "reason": "rising_search",
      "matched_terms": [
        "royal caribbean bahamas cruise rerouted"
      ]
    }
  ],
  "fallback_used": false
}
