{
  "schema_version": 1,
  "generated_at": "2026-06-25T15:53:14.394Z",
  "date": "2026-06-24",
  "expires_at": "2026-06-26T15:53:14.394Z",
  "source": {
    "provider": "google_trends",
    "dataset": "bigquery-public-data.google_trends",
    "region": "US",
    "tables": [
      "top_terms",
      "top_rising_terms"
    ],
    "attribution": "Data source: Google Trends"
  },
  "items": [
    {
      "rank": 1,
      "slug": "iraq",
      "word": "Iraq",
      "score": 92,
      "reason": "rising_search",
      "matched_terms": [
        "france vs iraq"
      ]
    },
    {
      "rank": 2,
      "slug": "bar",
      "word": "bar",
      "score": 90,
      "reason": "top_search",
      "matched_terms": [
        "federal judge bars trump from implementing proof of citizenship requirement to vote"
      ]
    },
    {
      "rank": 3,
      "slug": "austrian",
      "word": "Austrian",
      "score": 87,
      "reason": "rising_search",
      "matched_terms": [
        "argentina vs austria",
        "argentina austria"
      ]
    },
    {
      "rank": 4,
      "slug": "world",
      "word": "world",
      "score": 86,
      "reason": "top_search",
      "matched_terms": [
        "canada world cup",
        "fifa world cup 2026 standings"
      ]
    },
    {
      "rank": 5,
      "slug": "portugal",
      "word": "Portugal",
      "score": 86,
      "reason": "rising_search",
      "matched_terms": [
        "portugal vs uzbekistan"
      ]
    },
    {
      "rank": 6,
      "slug": "implement",
      "word": "implement",
      "score": 84,
      "reason": "top_search",
      "matched_terms": [
        "federal judge bars trump from implementing proof of citizenship requirement to vote"
      ]
    },
    {
      "rank": 7,
      "slug": "game",
      "word": "game",
      "score": 84,
      "reason": "top_search",
      "matched_terms": [
        "mexico game today",
        "rockstar games"
      ]
    },
    {
      "rank": 8,
      "slug": "check",
      "word": "check",
      "score": 82,
      "reason": "rising_search",
      "matched_terms": [
        "june 24 social security check"
      ]
    },
    {
      "rank": 9,
      "slug": "cancel",
      "word": "cancel",
      "score": 80,
      "reason": "top_search",
      "matched_terms": [
        "trump cancels signing of housing bill"
      ]
    }
  ],
  "fallback_used": false
}
