{
  "schema_version": 1,
  "generated_at": "2026-05-22T15:55:38.673Z",
  "date": "2026-05-21",
  "expires_at": "2026-05-23T15:55:38.673Z",
  "source": {
    "provider": "google_trends",
    "dataset": "bigquery-public-data.google_trends",
    "region": "US",
    "tables": [
      "top_terms",
      "top_rising_terms"
    ],
    "attribution": "Data source: Google Trends"
  },
  "items": [
    {
      "rank": 1,
      "slug": "book",
      "word": "book",
      "score": 94,
      "reason": "rising_search",
      "matched_terms": [
        "judy blume books"
      ]
    },
    {
      "rank": 2,
      "slug": "stop",
      "word": "stop",
      "score": 92,
      "reason": "rising_search",
      "matched_terms": [
        "dfw ground stop"
      ]
    },
    {
      "rank": 3,
      "slug": "judge",
      "word": "judge",
      "score": 88,
      "reason": "top_search",
      "matched_terms": [
        "trump administration immigration judges"
      ]
    },
    {
      "rank": 4,
      "slug": "squad",
      "word": "squad",
      "score": 88,
      "reason": "top_search",
      "matched_terms": [
        "england world cup squad"
      ]
    },
    {
      "rank": 5,
      "slug": "world",
      "word": "world",
      "score": 88,
      "reason": "top_search",
      "matched_terms": [
        "england world cup squad"
      ]
    },
    {
      "rank": 6,
      "slug": "fleet",
      "word": "fleet",
      "score": 86,
      "reason": "top_search",
      "matched_terms": [
        "naval fleet"
      ]
    },
    {
      "rank": 7,
      "slug": "recall",
      "word": "recall",
      "score": 84,
      "reason": "top_search",
      "matched_terms": [
        "nhtsa honda rearview camera recall"
      ]
    },
    {
      "rank": 8,
      "slug": "bucket",
      "word": "bucket",
      "score": 84,
      "reason": "top_search",
      "matched_terms": [
        "scary movie 6 popcorn bucket"
      ]
    },
    {
      "rank": 9,
      "slug": "movie",
      "word": "movie",
      "score": 84,
      "reason": "top_search",
      "matched_terms": [
        "scary movie 6 popcorn bucket"
      ]
    }
  ],
  "fallback_used": false
}
