{
  "schema_version": 1,
  "generated_at": "2026-05-12T11:17:06.546Z",
  "date": "2026-05-11",
  "expires_at": "2026-05-13T11:17:06.546Z",
  "source": {
    "provider": "google_trends",
    "dataset": "bigquery-public-data.google_trends",
    "region": "US",
    "tables": [
      "top_terms",
      "top_rising_terms"
    ],
    "attribution": "Data source: Google Trends"
  },
  "items": [
    {
      "rank": 1,
      "slug": "cancel",
      "word": "cancel",
      "score": 94,
      "reason": "top_search",
      "matched_terms": [
        "nbc canceled shows 2026"
      ]
    },
    {
      "rank": 2,
      "slug": "show",
      "word": "show",
      "score": 94,
      "reason": "top_search",
      "matched_terms": [
        "nbc shows",
        "nbc canceled shows 2026"
      ]
    },
    {
      "rank": 3,
      "slug": "brave",
      "word": "brave",
      "score": 93,
      "reason": "rising_search",
      "matched_terms": [
        "braves vs dodgers"
      ]
    },
    {
      "rank": 4,
      "slug": "check",
      "word": "check",
      "score": 92,
      "reason": "top_search",
      "matched_terms": [
        "may 13 social security check"
      ]
    },
    {
      "rank": 5,
      "slug": "class",
      "word": "class",
      "score": 90,
      "reason": "top_search",
      "matched_terms": [
        "ohio-class submarine"
      ]
    },
    {
      "rank": 6,
      "slug": "submarine",
      "word": "submarine",
      "score": 90,
      "reason": "top_search",
      "matched_terms": [
        "ohio-class submarine"
      ]
    },
    {
      "rank": 7,
      "slug": "tonight",
      "word": "tonight",
      "score": 88,
      "reason": "rising_search",
      "matched_terms": [
        "ufc tonight"
      ]
    },
    {
      "rank": 8,
      "slug": "airport",
      "word": "airport",
      "score": 87,
      "reason": "top_search",
      "matched_terms": [
        "philadelphia airport passenger currency confiscation"
      ]
    },
    {
      "rank": 9,
      "slug": "currency",
      "word": "currency",
      "score": 87,
      "reason": "top_search",
      "matched_terms": [
        "philadelphia airport passenger currency confiscation"
      ]
    }
  ],
  "fallback_used": false
}
