{
  "schema_version": 1,
  "generated_at": "2026-06-03T16:35:49.343Z",
  "date": "2026-06-02",
  "expires_at": "2026-06-04T16:35:49.343Z",
  "source": {
    "provider": "google_trends",
    "dataset": "bigquery-public-data.google_trends",
    "region": "US",
    "tables": [
      "top_terms",
      "top_rising_terms"
    ],
    "attribution": "Data source: Google Trends"
  },
  "items": [
    {
      "rank": 1,
      "slug": "cut",
      "word": "cut",
      "score": 86,
      "reason": "top_search",
      "matched_terms": [
        "social security administration staffing cuts"
      ]
    },
    {
      "rank": 2,
      "slug": "staff",
      "word": "staff",
      "score": 86,
      "reason": "top_search",
      "matched_terms": [
        "social security administration staffing cuts"
      ]
    },
    {
      "rank": 3,
      "slug": "verse",
      "word": "verse",
      "score": 85,
      "reason": "rising_search",
      "matched_terms": [
        "jared verse"
      ]
    },
    {
      "rank": 4,
      "slug": "square",
      "word": "square",
      "score": 81,
      "reason": "top_search",
      "matched_terms": [
        "red lobster times square closure"
      ]
    },
    {
      "rank": 5,
      "slug": "belgium",
      "word": "Belgium",
      "score": 81,
      "reason": "top_search",
      "matched_terms": [
        "croatia vs belgium"
      ]
    },
    {
      "rank": 6,
      "slug": "grant",
      "word": "grant",
      "score": 80,
      "reason": "top_search",
      "matched_terms": [
        "trump administration federal grant oversight"
      ]
    },
    {
      "rank": 7,
      "slug": "brown",
      "word": "brown",
      "score": 80,
      "reason": "rising_search",
      "matched_terms": [
        "aj brown"
      ]
    },
    {
      "rank": 8,
      "slug": "county",
      "word": "county",
      "score": 79,
      "reason": "top_search",
      "matched_terms": [
        "pima county"
      ]
    },
    {
      "rank": 9,
      "slug": "spur",
      "word": "spur",
      "score": 79,
      "reason": "rising_search",
      "matched_terms": [
        "spurs vs knicks"
      ]
    }
  ],
  "fallback_used": false
}
