{
  "schema_version": 1,
  "generated_at": "2026-06-19T16:02:25.616Z",
  "date": "2026-06-18",
  "expires_at": "2026-06-20T16:02:25.616Z",
  "source": {
    "provider": "google_trends",
    "dataset": "bigquery-public-data.google_trends",
    "region": "US",
    "tables": [
      "top_terms",
      "top_rising_terms"
    ],
    "attribution": "Data source: Google Trends"
  },
  "items": [
    {
      "rank": 1,
      "slug": "push",
      "word": "push",
      "score": 95,
      "reason": "top_search",
      "matched_terms": [
        "justice department denaturalization push"
      ]
    },
    {
      "rank": 2,
      "slug": "jelly",
      "word": "jelly",
      "score": 91,
      "reason": "rising_search",
      "matched_terms": [
        "jelly roll",
        "jelly roll files for divorce"
      ]
    },
    {
      "rank": 3,
      "slug": "meteor",
      "word": "meteor",
      "score": 91,
      "reason": "top_search",
      "matched_terms": [
        "mars meteorite garnet discovery"
      ]
    },
    {
      "rank": 4,
      "slug": "department",
      "word": "department",
      "score": 89,
      "reason": "top_search",
      "matched_terms": [
        "justice department denaturalization push"
      ]
    },
    {
      "rank": 5,
      "slug": "football",
      "word": "football",
      "score": 87,
      "reason": "top_search",
      "matched_terms": [
        "czech republic national football team vs south africa national soccer team standings"
      ]
    },
    {
      "rank": 6,
      "slug": "portugal",
      "word": "Portugal",
      "score": 85,
      "reason": "rising_search",
      "matched_terms": [
        "portugal rd congo",
        "portugal vs",
        "portugal vs dr congo"
      ]
    },
    {
      "rank": 7,
      "slug": "case",
      "word": "case",
      "score": 84,
      "reason": "top_search",
      "matched_terms": [
        "florida ivf mixup case"
      ]
    },
    {
      "rank": 8,
      "slug": "giant",
      "word": "giant",
      "score": 83,
      "reason": "rising_search",
      "matched_terms": [
        "giants vs braves"
      ]
    },
    {
      "rank": 9,
      "slug": "brave",
      "word": "brave",
      "score": 81,
      "reason": "rising_search",
      "matched_terms": [
        "giants vs braves"
      ]
    }
  ],
  "fallback_used": false
}
