{
  "schema_version": 1,
  "generated_at": "2026-08-08T15:08:44.061Z",
  "date": "2026-08-07",
  "expires_at": "2026-08-09T15:08:44.061Z",
  "source": {
    "provider": "google_trends",
    "dataset": "bigquery-public-data.google_trends",
    "region": "US",
    "tables": [
      "top_terms",
      "top_rising_terms"
    ],
    "attribution": "Data source: Google Trends"
  },
  "items": [
    {
      "rank": 1,
      "slug": "weather",
      "word": "weather",
      "score": 87,
      "reason": "top_search",
      "matched_terms": [
        "winter weather predictions"
      ]
    },
    {
      "rank": 2,
      "slug": "tiger",
      "word": "tiger",
      "score": 87,
      "reason": "rising_search",
      "matched_terms": [
        "tigers vs mariners"
      ]
    },
    {
      "rank": 3,
      "slug": "step",
      "word": "step",
      "score": 86,
      "reason": "rising_search",
      "matched_terms": [
        "spanish steps"
      ]
    },
    {
      "rank": 4,
      "slug": "release",
      "word": "release",
      "score": 85,
      "reason": "top_search",
      "matched_terms": [
        "mountain dew baja leo release"
      ]
    },
    {
      "rank": 5,
      "slug": "chain",
      "word": "chain",
      "score": 85,
      "reason": "rising_search",
      "matched_terms": [
        "restaurant chain"
      ]
    },
    {
      "rank": 6,
      "slug": "salad",
      "word": "salad",
      "score": 82,
      "reason": "rising_search",
      "matched_terms": [
        "salad and go"
      ]
    },
    {
      "rank": 7,
      "slug": "port",
      "word": "port",
      "score": 81,
      "reason": "top_search",
      "matched_terms": [
        "wolves vs port vale"
      ]
    },
    {
      "rank": 8,
      "slug": "wolf",
      "word": "wolf",
      "score": 81,
      "reason": "top_search",
      "matched_terms": [
        "wolves vs port vale"
      ]
    },
    {
      "rank": 9,
      "slug": "blacksmith",
      "word": "blacksmith",
      "score": 81,
      "reason": "top_search",
      "matched_terms": [
        "justice smith"
      ]
    }
  ],
  "fallback_used": false
}
