{
  "schema_version": 1,
  "generated_at": "2026-07-18T15:21:51.743Z",
  "date": "2026-07-17",
  "expires_at": "2026-07-19T15:21:51.743Z",
  "source": {
    "provider": "google_trends",
    "dataset": "bigquery-public-data.google_trends",
    "region": "US",
    "tables": [
      "top_terms",
      "top_rising_terms"
    ],
    "attribution": "Data source: Google Trends"
  },
  "items": [
    {
      "rank": 1,
      "slug": "wildfire",
      "word": "wildfire",
      "score": 91,
      "reason": "rising_search",
      "matched_terms": [
        "canadian wildfires",
        "canada wildfires"
      ]
    },
    {
      "rank": 2,
      "slug": "match",
      "word": "match",
      "score": 87,
      "reason": "top_search",
      "matched_terms": [
        "world cup 3rd place match"
      ]
    },
    {
      "rank": 3,
      "slug": "ray",
      "word": "ray",
      "score": 87,
      "reason": "top_search",
      "matched_terms": [
        "rays vs red sox"
      ]
    },
    {
      "rank": 4,
      "slug": "persian",
      "word": "Persian",
      "score": 86,
      "reason": "top_search",
      "matched_terms": [
        "fox news iran"
      ]
    },
    {
      "rank": 5,
      "slug": "recall",
      "word": "recall",
      "score": 82,
      "reason": "top_search",
      "matched_terms": [
        "madewell tj maxx sweater recall",
        "us canada panasonic toaster recall"
      ]
    },
    {
      "rank": 6,
      "slug": "world",
      "word": "world",
      "score": 81,
      "reason": "mixed_signal",
      "matched_terms": [
        "world cup final",
        "fifa world cup 2026",
        "world cup 3rd place match",
        "argentina world cup",
        "england world cup"
      ]
    },
    {
      "rank": 7,
      "slug": "hint",
      "word": "hint",
      "score": 81,
      "reason": "rising_search",
      "matched_terms": [
        "wordle hint"
      ]
    },
    {
      "rank": 8,
      "slug": "rescue",
      "word": "rescue",
      "score": 78,
      "reason": "top_search",
      "matched_terms": [
        "kansas city porta potty rescue"
      ]
    },
    {
      "rank": 9,
      "slug": "code",
      "word": "code",
      "score": 77,
      "reason": "top_search",
      "matched_terms": [
        "anime expeditions codes"
      ]
    }
  ],
  "fallback_used": false
}
