{
  "schema_version": 1,
  "generated_at": "2026-07-02T15:48:36.700Z",
  "date": "2026-07-01",
  "expires_at": "2026-07-03T15:48:36.700Z",
  "source": {
    "provider": "google_trends",
    "dataset": "bigquery-public-data.google_trends",
    "region": "US",
    "tables": [
      "top_terms",
      "top_rising_terms"
    ],
    "attribution": "Data source: Google Trends"
  },
  "items": [
    {
      "rank": 1,
      "slug": "belgium",
      "word": "Belgium",
      "score": 89,
      "reason": "top_search",
      "matched_terms": [
        "senegal vs belgium"
      ]
    },
    {
      "rank": 2,
      "slug": "netherlands",
      "word": "Netherlands",
      "score": 88,
      "reason": "rising_search",
      "matched_terms": [
        "morocco vs netherlands"
      ]
    },
    {
      "rank": 3,
      "slug": "block",
      "word": "block",
      "score": 86,
      "reason": "top_search",
      "matched_terms": [
        "judges block trump loan regulation"
      ]
    },
    {
      "rank": 4,
      "slug": "judge",
      "word": "judge",
      "score": 86,
      "reason": "top_search",
      "matched_terms": [
        "judges block trump loan regulation"
      ]
    },
    {
      "rank": 5,
      "slug": "loan",
      "word": "loan",
      "score": 80,
      "reason": "top_search",
      "matched_terms": [
        "judges block trump loan regulation"
      ]
    },
    {
      "rank": 6,
      "slug": "eagle",
      "word": "eagle",
      "score": 78,
      "reason": "top_search",
      "matched_terms": [
        "giant eagle"
      ]
    },
    {
      "rank": 7,
      "slug": "ivory",
      "word": "ivory",
      "score": 76,
      "reason": "rising_search",
      "matched_terms": [
        "norway vs ivory coast"
      ]
    },
    {
      "rank": 8,
      "slug": "cancer",
      "word": "cancer",
      "score": 74,
      "reason": "top_search",
      "matched_terms": [
        "cancer"
      ]
    },
    {
      "rank": 9,
      "slug": "brown",
      "word": "brown",
      "score": 71,
      "reason": "top_search",
      "matched_terms": [
        "chris brown housekeeper verdict"
      ]
    }
  ],
  "fallback_used": false
}
