{
  "schema_version": 1,
  "generated_at": "2026-09-08T15:11:38.683Z",
  "date": "2026-09-07",
  "expires_at": "2026-09-09T15:11:38.683Z",
  "source": {
    "provider": "google_trends",
    "dataset": "bigquery-public-data.google_trends",
    "region": "US",
    "tables": [
      "top_terms",
      "top_rising_terms"
    ],
    "attribution": "Data source: Google Trends"
  },
  "items": [
    {
      "rank": 1,
      "slug": "game",
      "word": "game",
      "score": 85,
      "reason": "rising_search",
      "matched_terms": [
        "lsu game"
      ]
    },
    {
      "rank": 2,
      "slug": "tiger",
      "word": "tiger",
      "score": 83,
      "reason": "top_search",
      "matched_terms": [
        "twins vs tigers"
      ]
    },
    {
      "rank": 3,
      "slug": "twin",
      "word": "twin",
      "score": 83,
      "reason": "top_search",
      "matched_terms": [
        "twins vs tigers"
      ]
    },
    {
      "rank": 4,
      "slug": "ball",
      "word": "ball",
      "score": 82,
      "reason": "rising_search",
      "matched_terms": [
        "ball state vs ohio state"
      ]
    },
    {
      "rank": 5,
      "slug": "football",
      "word": "football",
      "score": 82,
      "reason": "rising_search",
      "matched_terms": [
        "clemson football",
        "lsu football",
        "oregon football",
        "michigan football"
      ]
    },
    {
      "rank": 6,
      "slug": "club",
      "word": "club",
      "score": 80,
      "reason": "top_search",
      "matched_terms": [
        "sam's club"
      ]
    },
    {
      "rank": 7,
      "slug": "harry",
      "word": "harry",
      "score": 75,
      "reason": "top_search",
      "matched_terms": [
        "king charles prince harry meghan status"
      ]
    },
    {
      "rank": 8,
      "slug": "tennessee",
      "word": "Tennessee",
      "score": 70,
      "reason": "rising_search",
      "matched_terms": [
        "furman vs tennessee"
      ]
    },
    {
      "rank": 9,
      "slug": "swift",
      "word": "swift",
      "score": 69,
      "reason": "top_search",
      "matched_terms": [
        "travis kelce taylor swift manhattan date"
      ]
    }
  ],
  "fallback_used": false
}
