{
  "schema_version": 1,
  "generated_at": "2026-06-09T16:02:24.812Z",
  "date": "2026-06-08",
  "expires_at": "2026-06-10T16:02:24.812Z",
  "source": {
    "provider": "google_trends",
    "dataset": "bigquery-public-data.google_trends",
    "region": "US",
    "tables": [
      "top_terms",
      "top_rising_terms"
    ],
    "attribution": "Data source: Google Trends"
  },
  "items": [
    {
      "rank": 1,
      "slug": "chile",
      "word": "Chile",
      "score": 90,
      "reason": "rising_search",
      "matched_terms": [
        "portugal chile",
        "portugal vs chile"
      ]
    },
    {
      "rank": 2,
      "slug": "portugal",
      "word": "Portugal",
      "score": 90,
      "reason": "rising_search",
      "matched_terms": [
        "portugal chile",
        "portugal vs chile"
      ]
    },
    {
      "rank": 3,
      "slug": "cancel",
      "word": "cancel",
      "score": 90,
      "reason": "top_search",
      "matched_terms": [
        "nbc cancels 9 tv shows"
      ]
    },
    {
      "rank": 4,
      "slug": "valley",
      "word": "valley",
      "score": 87,
      "reason": "top_search",
      "matched_terms": [
        "sorrento valley fire"
      ]
    },
    {
      "rank": 5,
      "slug": "netherlands",
      "word": "Netherlands",
      "score": 84,
      "reason": "top_search",
      "matched_terms": [
        "netherlands vs uzbekistan"
      ]
    },
    {
      "rank": 6,
      "slug": "sale",
      "word": "sale",
      "score": 83,
      "reason": "top_search",
      "matched_terms": [
        "us date fruit sales growth"
      ]
    },
    {
      "rank": 7,
      "slug": "visa",
      "word": "visa",
      "score": 82,
      "reason": "top_search",
      "matched_terms": [
        "federal judge voids trump's $100000 fee requirement for h 1b visas"
      ]
    },
    {
      "rank": 8,
      "slug": "void",
      "word": "void",
      "score": 82,
      "reason": "top_search",
      "matched_terms": [
        "federal judge voids trump's $100000 fee requirement for h 1b visas"
      ]
    },
    {
      "rank": 9,
      "slug": "fever",
      "word": "fever",
      "score": 80,
      "reason": "rising_search",
      "matched_terms": [
        "fever vs liberty"
      ]
    }
  ],
  "fallback_used": false
}
