{
  "schema_version": 1,
  "generated_at": "2026-09-25T15:11:52.897Z",
  "date": "2026-09-24",
  "expires_at": "2026-09-26T15:11:52.897Z",
  "source": {
    "provider": "google_trends",
    "dataset": "bigquery-public-data.google_trends",
    "region": "US",
    "tables": [
      "top_terms",
      "top_rising_terms"
    ],
    "attribution": "Data source: Google Trends"
  },
  "items": [
    {
      "rank": 1,
      "slug": "latin",
      "word": "Latin",
      "score": 92,
      "reason": "rising_search",
      "matched_terms": [
        "latin pop"
      ]
    },
    {
      "rank": 2,
      "slug": "dream",
      "word": "dream",
      "score": 90,
      "reason": "top_search",
      "matched_terms": [
        "dream vs liberty"
      ]
    },
    {
      "rank": 3,
      "slug": "liberty",
      "word": "liberty",
      "score": 90,
      "reason": "top_search",
      "matched_terms": [
        "dream vs liberty"
      ]
    },
    {
      "rank": 4,
      "slug": "hurricane",
      "word": "hurricane",
      "score": 90,
      "reason": "rising_search",
      "matched_terms": [
        "hurricane polo"
      ]
    },
    {
      "rank": 5,
      "slug": "ray",
      "word": "ray",
      "score": 89,
      "reason": "rising_search",
      "matched_terms": [
        "rays vs yankees"
      ]
    },
    {
      "rank": 6,
      "slug": "fever",
      "word": "fever",
      "score": 86,
      "reason": "rising_search",
      "matched_terms": [
        "lynx vs fever"
      ]
    },
    {
      "rank": 7,
      "slug": "coffee",
      "word": "coffee",
      "score": 85,
      "reason": "rising_search",
      "matched_terms": [
        "best coffee grinder"
      ]
    },
    {
      "rank": 8,
      "slug": "grind",
      "word": "grind",
      "score": 85,
      "reason": "rising_search",
      "matched_terms": [
        "best coffee grinder"
      ]
    },
    {
      "rank": 9,
      "slug": "storm",
      "word": "storm",
      "score": 85,
      "reason": "top_search",
      "matched_terms": [
        "wings vs storm"
      ]
    }
  ],
  "fallback_used": false
}
