{
  "schema_version": 1,
  "generated_at": "2026-09-07T15:10:21.717Z",
  "date": "2026-09-06",
  "expires_at": "2026-09-08T15:10:21.717Z",
  "source": {
    "provider": "google_trends",
    "dataset": "bigquery-public-data.google_trends",
    "region": "US",
    "tables": [
      "top_terms",
      "top_rising_terms"
    ],
    "attribution": "Data source: Google Trends"
  },
  "items": [
    {
      "rank": 1,
      "slug": "opinion",
      "word": "opinion",
      "score": 91,
      "reason": "rising_search",
      "matched_terms": [
        "opine",
        "opine meaning"
      ]
    },
    {
      "rank": 2,
      "slug": "clay",
      "word": "clay",
      "score": 85,
      "reason": "rising_search",
      "matched_terms": [
        "clay matthews"
      ]
    },
    {
      "rank": 3,
      "slug": "type",
      "word": "type",
      "score": 84,
      "reason": "rising_search",
      "matched_terms": [
        "types of eels"
      ]
    },
    {
      "rank": 4,
      "slug": "ball",
      "word": "ball",
      "score": 82,
      "reason": "rising_search",
      "matched_terms": [
        "ball state vs ohio state"
      ]
    },
    {
      "rank": 5,
      "slug": "brave",
      "word": "brave",
      "score": 81,
      "reason": "rising_search",
      "matched_terms": [
        "braves vs phillies"
      ]
    },
    {
      "rank": 6,
      "slug": "tiger",
      "word": "tiger",
      "score": 80,
      "reason": "rising_search",
      "matched_terms": [
        "tigers vs guardians"
      ]
    },
    {
      "rank": 7,
      "slug": "football",
      "word": "football",
      "score": 80,
      "reason": "mixed_signal",
      "matched_terms": [
        "college football scores",
        "ncaa football scores",
        "oregon football",
        "football games today"
      ]
    },
    {
      "rank": 8,
      "slug": "white",
      "word": "white",
      "score": 79,
      "reason": "top_search",
      "matched_terms": [
        "white house ballroom construction ruling"
      ]
    },
    {
      "rank": 9,
      "slug": "airport",
      "word": "airport",
      "score": 78,
      "reason": "top_search",
      "matched_terms": [
        "miami airport"
      ]
    }
  ],
  "fallback_used": false
}
