{
  "schema_version": 1,
  "generated_at": "2026-07-20T15:37:52.185Z",
  "date": "2026-07-19",
  "expires_at": "2026-07-21T15:37:52.185Z",
  "source": {
    "provider": "google_trends",
    "dataset": "bigquery-public-data.google_trends",
    "region": "US",
    "tables": [
      "top_terms",
      "top_rising_terms"
    ],
    "attribution": "Data source: Google Trends"
  },
  "items": [
    {
      "rank": 1,
      "slug": "game",
      "word": "game",
      "score": 97,
      "reason": "rising_search",
      "matched_terms": [
        "crane game"
      ]
    },
    {
      "rank": 2,
      "slug": "state",
      "word": "state",
      "score": 95,
      "reason": "top_search",
      "matched_terms": [
        "united states congress"
      ]
    },
    {
      "rank": 3,
      "slug": "element",
      "word": "element",
      "score": 92,
      "reason": "rising_search",
      "matched_terms": [
        "classical elements"
      ]
    },
    {
      "rank": 4,
      "slug": "crane",
      "word": "crane",
      "score": 91,
      "reason": "rising_search",
      "matched_terms": [
        "crane game"
      ]
    },
    {
      "rank": 5,
      "slug": "ray",
      "word": "ray",
      "score": 90,
      "reason": "rising_search",
      "matched_terms": [
        "rays vs red sox"
      ]
    },
    {
      "rank": 6,
      "slug": "hour",
      "word": "hour",
      "score": 87,
      "reason": "top_search",
      "matched_terms": [
        "grandparents happy hour bill minnesota"
      ]
    },
    {
      "rank": 7,
      "slug": "fever",
      "word": "fever",
      "score": 87,
      "reason": "rising_search",
      "matched_terms": [
        "storm vs fever"
      ]
    },
    {
      "rank": 8,
      "slug": "storm",
      "word": "storm",
      "score": 87,
      "reason": "rising_search",
      "matched_terms": [
        "storm vs fever"
      ]
    },
    {
      "rank": 9,
      "slug": "season",
      "word": "season",
      "score": 86,
      "reason": "top_search",
      "matched_terms": [
        "ed harris dutton ranch season 2"
      ]
    }
  ],
  "fallback_used": false
}
