{
  "schema_version": 1,
  "generated_at": "2026-08-20T15:12:16.998Z",
  "date": "2026-08-19",
  "expires_at": "2026-08-21T15:12:16.998Z",
  "source": {
    "provider": "google_trends",
    "dataset": "bigquery-public-data.google_trends",
    "region": "US",
    "tables": [
      "top_terms",
      "top_rising_terms"
    ],
    "attribution": "Data source: Google Trends"
  },
  "items": [
    {
      "rank": 1,
      "slug": "movie",
      "word": "movie",
      "score": 88,
      "reason": "rising_search",
      "matched_terms": [
        "hayden panettiere movies"
      ]
    },
    {
      "rank": 2,
      "slug": "recall",
      "word": "recall",
      "score": 88,
      "reason": "top_search",
      "matched_terms": [
        "blueberry recall",
        "dog food recall"
      ]
    },
    {
      "rank": 3,
      "slug": "aircraft",
      "word": "aircraft",
      "score": 87,
      "reason": "top_search",
      "matched_terms": [
        "aircraft pilot"
      ]
    },
    {
      "rank": 4,
      "slug": "pilot",
      "word": "pilot",
      "score": 87,
      "reason": "top_search",
      "matched_terms": [
        "aircraft pilot"
      ]
    },
    {
      "rank": 5,
      "slug": "daughter",
      "word": "daughter",
      "score": 85,
      "reason": "mixed_signal",
      "matched_terms": [
        "hayden panettiere daughter",
        "joanna gaines daughters england trip"
      ]
    },
    {
      "rank": 6,
      "slug": "cause",
      "word": "cause",
      "score": 82,
      "reason": "rising_search",
      "matched_terms": [
        "hayden panettiere cause of death"
      ]
    },
    {
      "rank": 7,
      "slug": "food",
      "word": "food",
      "score": 82,
      "reason": "top_search",
      "matched_terms": [
        "dog food recall"
      ]
    },
    {
      "rank": 8,
      "slug": "coffee",
      "word": "coffee",
      "score": 81,
      "reason": "rising_search",
      "matched_terms": [
        "cowboy coffee"
      ]
    },
    {
      "rank": 9,
      "slug": "cowboy",
      "word": "cowboy",
      "score": 81,
      "reason": "rising_search",
      "matched_terms": [
        "cowboy coffee"
      ]
    }
  ],
  "fallback_used": false
}
