{
  "schema_version": 1,
  "generated_at": "2026-10-29T20:03:38.600Z",
  "date": "2026-10-27",
  "expires_at": "2026-10-30T20:03:38.600Z",
  "source": {
    "provider": "google_trends",
    "dataset": "bigquery-public-data.google_trends",
    "region": "US",
    "tables": [
      "top_terms",
      "top_rising_terms"
    ],
    "attribution": "Data source: Google Trends"
  },
  "items": [
    {
      "rank": 1,
      "slug": "giant",
      "word": "giant",
      "score": 92,
      "reason": "rising_search",
      "matched_terms": [
        "giants vs texans"
      ]
    },
    {
      "rank": 2,
      "slug": "item",
      "word": "item",
      "score": 91,
      "reason": "top_search",
      "matched_terms": [
        "mcdonalds new holiday menu items"
      ]
    },
    {
      "rank": 3,
      "slug": "saint",
      "word": "saint",
      "score": 91,
      "reason": "mixed_signal",
      "matched_terms": [
        "steelers vs saints",
        "susan saint james"
      ]
    },
    {
      "rank": 4,
      "slug": "lion",
      "word": "lion",
      "score": 88,
      "reason": "rising_search",
      "matched_terms": [
        "packers vs lions"
      ]
    },
    {
      "rank": 5,
      "slug": "tribute",
      "word": "tribute",
      "score": 86,
      "reason": "rising_search",
      "matched_terms": [
        "troy aikman lawrence mccutcheon tribute"
      ]
    },
    {
      "rank": 6,
      "slug": "holiday",
      "word": "holiday",
      "score": 85,
      "reason": "top_search",
      "matched_terms": [
        "mcdonalds new holiday menu items"
      ]
    },
    {
      "rank": 7,
      "slug": "menu",
      "word": "menu",
      "score": 85,
      "reason": "top_search",
      "matched_terms": [
        "mcdonalds new holiday menu items"
      ]
    },
    {
      "rank": 8,
      "slug": "aircraft",
      "word": "aircraft",
      "score": 84,
      "reason": "top_search",
      "matched_terms": [
        "unruly aircraft passenger"
      ]
    },
    {
      "rank": 9,
      "slug": "panther",
      "word": "panther",
      "score": 79,
      "reason": "rising_search",
      "matched_terms": [
        "buccaneers vs panthers"
      ]
    }
  ],
  "fallback_used": false
}
