{
  "schema_version": 1,
  "generated_at": "2026-08-04T15:49:02.738Z",
  "date": "2026-08-03",
  "expires_at": "2026-08-05T15:49:02.738Z",
  "source": {
    "provider": "google_trends",
    "dataset": "bigquery-public-data.google_trends",
    "region": "US",
    "tables": [
      "top_terms",
      "top_rising_terms"
    ],
    "attribution": "Data source: Google Trends"
  },
  "items": [
    {
      "rank": 1,
      "slug": "fire",
      "word": "fire",
      "score": 96,
      "reason": "rising_search",
      "matched_terms": [
        "spokane fires"
      ]
    },
    {
      "rank": 2,
      "slug": "close",
      "word": "close",
      "score": 92,
      "reason": "mixed_signal",
      "matched_terms": [
        "walgreens 2026 store locations closing",
        "jcpenney anchor store closing"
      ]
    },
    {
      "rank": 3,
      "slug": "recall",
      "word": "recall",
      "score": 92,
      "reason": "rising_search",
      "matched_terms": [
        "woodure toddler stool recall"
      ]
    },
    {
      "rank": 4,
      "slug": "clay",
      "word": "clay",
      "score": 88,
      "reason": "top_search",
      "matched_terms": [
        "clay holmes"
      ]
    },
    {
      "rank": 5,
      "slug": "fever",
      "word": "fever",
      "score": 87,
      "reason": "rising_search",
      "matched_terms": [
        "fever vs lynx",
        "fever vs fire"
      ]
    },
    {
      "rank": 6,
      "slug": "field",
      "word": "field",
      "score": 87,
      "reason": "top_search",
      "matched_terms": [
        "natasha ward track and field"
      ]
    },
    {
      "rank": 7,
      "slug": "toddler",
      "word": "toddler",
      "score": 86,
      "reason": "rising_search",
      "matched_terms": [
        "woodure toddler stool recall"
      ]
    },
    {
      "rank": 8,
      "slug": "rating",
      "word": "rating",
      "score": 86,
      "reason": "top_search",
      "matched_terms": [
        "donald trump state approval ratings"
      ]
    },
    {
      "rank": 9,
      "slug": "tiger",
      "word": "tiger",
      "score": 85,
      "reason": "rising_search",
      "matched_terms": [
        "tigers vs athletics"
      ]
    }
  ],
  "fallback_used": false
}
